{
  "version": "1.0",
  "updated_at": "2026-09-10T00:00:00.000Z",
  "summaries": {
    "work": {
      "text": "",
      "updated_at": "2026-09-10T00:00:00.000Z"
    },
    "personal": {
      "text": "",
      "updated_at": "2026-09-10T00:00:00.000Z"
    },
    "focus": {
      "text": "",
      "updated_at": "2026-09-10T00:00:00.000Z"
    },
    "recent": {
      "text": "",
      "updated_at": "2026-09-10T00:00:00.000Z"
    },
    "earlier": {
      "text": "",
      "updated_at": "2026-09-10T00:00:00.000Z"
    },
    "long_term": {
      "text": "",
      "updated_at": "2026-09-10T00:00:00.000Z"
    }
  },
  "facts": []
}
